{
  "$schema": "https://json-schema.org/draft/2020-12/schema",
  "$id": "https://zhaohaoran-suanhai.github.io/hypermesh-weld-agent/marker-input-manifest.schema.json",
  "type": "object",
  "additionalProperties": false,
  "required": ["schema_version", "run_id", "hypermesh", "components"],
  "properties": {
    "schema_version": {"const": "1.0"},
    "run_id": {"type": "string", "pattern": "^[A-Za-z0-9][A-Za-z0-9._-]{0,63}$"},
    "hypermesh": {
      "type": "object",
      "additionalProperties": false,
      "required": ["build", "model_name", "units", "coordinate_system"],
      "properties": {
        "build": {"type": "string", "minLength": 1},
        "model_name": {"type": "string", "minLength": 1},
        "units": {"const": "mm"},
        "coordinate_system": {"const": "global"}
      }
    },
    "components": {
      "type": "array",
      "minItems": 1,
      "items": {
        "type": "object",
        "additionalProperties": false,
        "required": ["id", "name", "step_path", "summary"],
        "properties": {
          "id": {"type": "integer", "minimum": 1},
          "name": {"type": "string", "minLength": 1},
          "step_path": {"type": "string", "minLength": 1},
          "summary": {"$ref": "selection.schema.json#/$defs/geometry_summary"}
        }
      }
    }
  }
}
