{
  "schema_version": "1.0",
  "run_id": "marker-run-001",
  "hypermesh": {
    "build": "HyperMesh 2017",
    "model_name": "synthetic-marker-model",
    "units": "mm",
    "coordinate_system": "global"
  },
  "components": [
    {
      "id": 5,
      "name": "MARKERS-A",
      "step_path": "C:/synthetic/component-5.step",
      "summary": {
        "surface_count": 7,
        "solid_count": 1,
        "element_count": 0,
        "bbox": [0, 0, 0, 10, 10, 10]
      }
    },
    {
      "id": 12,
      "name": "MARKERS-B",
      "step_path": "C:/synthetic/component-12.step",
      "summary": {
        "surface_count": 12,
        "solid_count": 2,
        "element_count": 0,
        "bbox": [20, 0, 0, 40, 10, 10]
      }
    }
  ]
}
